video_url,user_url,username,title,view_num,created_at,shortdesc,collected_at
/watch?v=6_RdnVtfZPY&pp=ygUgaG9uZyBrb25nIHByb3Rlc3RzIDIwMTlIb25nIEtvbmc%3D,/@Vox,Vox,"Hong Kong’s huge protests, explained",9.6M,6 years,The people of Hong Kong are protesting in record-breaking numbers. Become a Video Lab member! http://bit.ly/video-lab ...,2026-01-22 02:55:14.412836
/watch?v=g9QIETD4QV0&pp=ygUgaG9uZyBrb25nIHByb3Rlc3RzIDIwMTlIb25nIEtvbmc%3D,/@nytimes,The New York Times,Hear Hong Kong Protesters Read Their Final Goodbyes | The Dispatch,293K,6 years,"As violence escalates between demonstrators and the police in Hong Kong, protesters have started writing “last letters” to their ...",2026-01-22 02:55:14.414270
/watch?v=c-AzfXMJkI8&pp=ygUgaG9uZyBrb25nIHByb3Rlc3RzIDIwMTlIb25nIEtvbmc%3D,/@ABCNews,ABC News,‘Citizen X’ and Hong Kong protesters’ battle for freedom | Nightline,2.1M,6 years,"Hong Kong's youth believe they are engaged in an existential struggle for the future of their region. A student, who asked to ...",2026-01-22 02:55:14.416041
/watch?v=pataOgLfhQQ&pp=ygUgaG9uZyBrb25nIHByb3Rlc3RzIDIwMTlIb25nIEtvbmc%3D,/@60minutes,60 Minutes,Jimmy Lai and Hong Kong pro-democracy demonstrations in 2019 | 60 Minutes Archive,27K,1 month,"60 Minutes reported from Hong Kong in 2019, when months of pro-democracy demonstrations turned increasingly violent. Jimmy ...",2026-01-22 02:55:14.419352
/watch?v=0oZHAPT-7ts&pp=ygUgaG9uZyBrb25nIHByb3Rlc3RzIDIwMTlIb25nIEtvbmc%3D,/@CBCTheNational,CBC News: The National,Hong Kong protests turn violent,251K,6 years,"Democracy protests in Hong Kong became violent on Tuesday, at least 66 people were injured, including one protester who was ...",2026-01-22 02:55:21.141730
/watch?v=qopfgTQxXGg&pp=ygUgaG9uZyBrb25nIHByb3Rlc3RzIDIwMTlIb25nIEtvbmc%3D,/@humanrightsfdn,Human Rights Foundation,Hong Kong Protests | June 2019,795,6 years,The people of Hong Kong took to the streets in June 2019 to protest. Their hope was to prevent the Hong Kong government from ...,2026-01-22 02:55:21.146675
/watch?v=j5yJmnuvx6M&pp=ygUgaG9uZyBrb25nIHByb3Rlc3RzIDIwMTlIb25nIEtvbmc%3D,/@CBSSundayMorning,CBS Sunday Morning,Sunday Journal: The origin of Hong Kong protests,74K,6 years,For months protesters in Hong Kong have demonstrated against a new law being debated that would curtail democratic principles ...,2026-01-22 02:55:21.148499
/watch?v=DtFlljI5t1I&pp=ygUgaG9uZyBrb25nIHByb3Rlc3RzIDIwMTlIb25nIEtvbmc%3D,/@BBCNews,BBC News,Hong Kong protests: A city's identity crisis - BBC News,422K,6 years,Hong Kong's protests have become increasingly violent as they continue into their sixth month. The fabric of the place is ...,2026-01-22 02:55:21.149778
/watch?v=j5YKKPizQi8&pp=ygUgaG9uZyBrb25nIHByb3Rlc3RzIDIwMTlIb25nIEtvbmc%3D,/@VICE,VICE,Inside Hong Kong's Fight for Freedom | Faceless (Full Film) | The Short List,556K,3 years,Faceless is an intimate portrayal of four young protestors in Hong Kong struggling to protect their freedom and way of life under ...,2026-01-22 02:55:21.153597
/watch?v=cYcgHgIdlxQ&pp=ygUgaG9uZyBrb25nIHByb3Rlc3RzIDIwMTlIb25nIEtvbmc%3D,/@hydrolooper8411,Hydro Looper,BBC: Our World 2019 - Inside the Hong Kong Protests,6.3K,6 years,"For five months protests have rocked Hong Kong, pitting hundreds of thousands of young, idealistic demonstrators against the ...",2026-01-22 02:55:21.154869
/watch?v=4bT7dDDkEq8&pp=ygUgaG9uZyBrb25nIHByb3Rlc3RzIDIwMTlIb25nIEtvbmc%3D,/@Reuters,Reuters,HK court sentences seven for 2019 attack on protesters,1.6K,4 years,A Hong Kong court sentenced seven men to between 3-1/2 and 7 years in prison for their role in a 2019 attack on pro-democracy ...,2026-01-22 02:55:21.157317
/watch?v=bScglx8Mgtc&pp=ygUgaG9uZyBrb25nIHByb3Rlc3RzIDIwMTlIb25nIEtvbmfSBwkJhwoBhyohjO8%3D,/@SkyNews,Sky News,Protesters in Hong Kong battle police over extradition bill,666K,6 years,Hong Kong police fired pepper spray and tear gas at protesters angry about an extradition bill that would allow people to be sent ...,2026-01-22 02:55:21.161332
/watch?v=X-GR88q8pIw&pp=ygUgaG9uZyBrb25nIHByb3Rlc3RzIDIwMTlIb25nIEtvbmc%3D,/@markets,Bloomberg Television,Watch Hong Kong Protesters Attack JPMorgan Banker,163K,6 years,Oct.04 -- A JPMorgan Chase & Co. employee was attacked and punched by a protester outside the company's main Hong Kong ...,2026-01-22 02:55:21.162778
/watch?v=OIqx3YIHntc&pp=ygUgaG9uZyBrb25nIHByb3Rlc3RzIDIwMTlIb25nIEtvbmc%3D,/@SouthChinaMorningPost,South China Morning Post,Widespread vandalism during 19th straight weekend of Hong Kong protests,577K,6 years,Read more here: https://sc.mp/slw9e Subscribe to our YouTube channel for free here: https://sc.mp/subscribe-youtube Masked ...,2026-01-22 02:55:21.166864
/watch?v=wXOJX-ysXNA&pp=ygUgaG9uZyBrb25nIHByb3Rlc3RzIDIwMTlIb25nIEtvbmc%3D,/@CBCNews,CBC News,Hong Kong's protests explained,54K,3 years,Massive protests took place in Hong Kong in 2019 in response to China's increasing control over the small territory. Here's why it's ...,2026-01-22 02:55:21.169565
/watch?v=kG62SDFl8C4&pp=ygUgaG9uZyBrb25nIHByb3Rlc3RzIDIwMTlIb25nIEtvbmc%3D,/@SBSDateline,SBS Dateline,Meet the forces behind Hong Kong's historic protests,168K,6 years,How do you turn an entire city into a protest movement? Dateline meets the organisers of Hong Kong's pro-democracy protests.,2026-01-22 02:55:21.173717
/watch?v=4lGulxt2X-k&pp=ygUgaG9uZyBrb25nIHByb3Rlc3RzIDIwMTlIb25nIEtvbmc%3D,/@SouthChinaMorningPost,South China Morning Post,Protests continue to grip Hong Kong,1M,6 years,Subscribe to our YouTube channel for free here: https://sc.mp/subscribe-youtube Protests continued in Hong Kong through the ...,2026-01-22 02:55:21.178276
/watch?v=jblDG4Dj7x8&pp=ygUgaG9uZyBrb25nIHByb3Rlc3RzIDIwMTlIb25nIEtvbmc%3D,/@didyouknowthat609,Did you know that?,2019 Hong Kong protests - explained,225,6 years,"Please leave a like, subscribe and enable the notifications to know more! Help us build this channel, comment on what else you ...",2026-01-22 02:55:21.179792
/watch?v=baAm-vANGeQ&pp=ygUgaG9uZyBrb25nIHByb3Rlc3RzIDIwMTlIb25nIEtvbmc%3D,/@guardiannews,Guardian News,Hong Kong protesters shoot arrows at police during clashes at Chinese University,324K,6 years,Protesters have armed themselves with arrows and petrol bombs in angry clashes at the Chinese University of Hong Kong.,2026-01-22 02:55:21.181120
/watch?v=V0iytr0qM90&pp=ygUgaG9uZyBrb25nIHByb3Rlc3RzIDIwMTlIb25nIEtvbmfSBwkJhwoBhyohjO8%3D,/@nytimes,The New York Times,How Hong Kong’s Protesters Evade Police and Keep the Demonstrations Alive | Visual Investigations,674K,6 years,Get an email as soon as our next Visual Investigation is published: https://nyti.ms/3xhj7dE Hong Kong's protesters have employed ...,2026-01-22 02:55:21.184964
/watch?v=32KTKXZZ-BI&pp=ygUgaG9uZyBrb25nIHByb3Rlc3RzIDIwMTlIb25nIEtvbmfSBwkJhwoBhyohjO8%3D,/@wsj,The Wall Street Journal,How Hong Kong Protesters Evade Surveillance With Tech | WSJ,7M,6 years,"Protesters in Hong Kong fear they are being monitored by the local government and potentially by China, a country at the cutting ...",2026-01-22 02:55:21.188627
/watch?v=uNecOTDXc_s&pp=ygUgaG9uZyBrb25nIHByb3Rlc3RzIDIwMTlIb25nIEtvbmc%3D,/@channelnewsasia,CNA,What has changed as Hong Kong marks five years since 2019 protests,26K,1 year,Hong Kong will mark five years since violent protests rocked the city and triggered sweeping changes to its political system.,2026-01-22 02:55:21.191321
/watch?v=xcODtfRb--M&pp=ygUgaG9uZyBrb25nIHByb3Rlc3RzIDIwMTlIb25nIEtvbmfSBwkJhwoBhyohjO8%3D,/@PBSNewsHour,PBS NewsHour,Pro-democracy demonstrators and Beijing fight for the future of Hong Kong,54K,6 years,Hong Kong residents have been protesting for months against an extradition bill that would have allowed criminal suspects to be ...,2026-01-22 02:55:21.197711
/watch?v=C_h1oJYyTe4&pp=ygUgaG9uZyBrb25nIHByb3Rlc3RzIDIwMTlIb25nIEtvbmfSBwkJhwoBhyohjO8%3D,/@globalnews,Global News,"Hong Kong police battle protesters, make mass arrests in violent weekend before China's National Day",216K,6 years,Pro-democracy protests in Hong Kong escalated over the weekend with some of the most violent clashes since demonstrations ...,2026-01-22 02:55:21.199212
/watch?v=d-tqfal4w34&pp=ygUhaG9uZyBrb25nIHByb3Rlc3RzIDIwMTkgSG9uZyBLb25n,/@dwnews,DW News,Hong Kong protests against extradition law | DW News,62K,6 years,In Hong Kong hundreds of thousands of people have taken to the streets for a huge rally against a proposed extradition law.,2026-01-22 02:55:30.169450
/watch?v=ogNqu_gWvs8&pp=ygUhaG9uZyBrb25nIHByb3Rlc3RzIDIwMTkgSG9uZyBLb25n,/@NBCNews,NBC News,Hong Kong Protests Halt City’s Transportation | NBC News Now,42K,6 years,"Protesters in Hong Kong blocked roads, trains, and tunnels in a strike that followed a weekend of demonstrations in the former ...",2026-01-22 02:55:30.171731
/watch?v=iejjwdxQDYw&pp=ygUhaG9uZyBrb25nIHByb3Rlc3RzIDIwMTkgSG9uZyBLb25n,/@BBCNews,BBC News,Hong Kong police storm metro system after protests - BBC News,395K,6 years,Hong Kong police have violently tackled suspected protesters after thousands of people marched in the city in defiance of a ban.,2026-01-22 02:55:30.176832
/watch?v=EVRlypakJso&pp=ygUhaG9uZyBrb25nIHByb3Rlc3RzIDIwMTkgSG9uZyBLb25n,/@SouthChinaMorningPost,South China Morning Post,Hong Kong protesters go on rampage after National Day shooting,279K,6 years,Subscribe to our YouTube channel for free here: https://sc.mp/subscribe-youtube Protesters vandalised businesses and railway ...,2026-01-22 02:55:30.180843
/watch?v=TWf1_kT03yw&pp=ygUhaG9uZyBrb25nIHByb3Rlc3RzIDIwMTkgSG9uZyBLb25n,/@CBSMornings,CBS Mornings,Teenage boy shot as protests raged in Hong Kong,87K,6 years,Weeks of anti-government protests in Hong Kong took yet another violent turn when a teenage boy was shot. Mass transit service ...,2026-01-22 02:55:30.182301
/watch?v=T5bDZEKtAfE&pp=ygUhaG9uZyBrb25nIHByb3Rlc3RzIDIwMTkgSG9uZyBLb25n,/@BBCNews,BBC News,Hong Kong protests: Airport cancels flights as thousands occupy - BBC News,40K,6 years,"The BBC's Stephen McDonell is in Hong Kong International Airport where departing flights has been cancelled , as ...",2026-01-22 02:55:30.183687
/watch?v=fMAgFicfN3g&pp=ygUhaG9uZyBrb25nIHByb3Rlc3RzIDIwMTkgSG9uZyBLb25n,/@markets,Bloomberg Television,China to Respond to Hong Kong Protests,49K,6 years,Jul.28 -- China's top Hong Kong policy office will give its first response on Monday on two months of increasingly chaotic unrest in ...,2026-01-22 02:55:30.185159
/watch?v=pfM1qPXoZ6o&pp=ygUhaG9uZyBrb25nIHByb3Rlc3RzIDIwMTkgSG9uZyBLb25n,/@ChinaUncensored,China Uncensored,Hong Kong Protests Have a New Target—the Chinese Communist Party,242K,6 years,"Hong Kong protesters have a new target—the Chinese Communist Party. After over 100 days of protest, protesters have shifted ...",2026-01-22 02:55:30.189204
/watch?v=XKuiYHhDeBM&pp=ygUhaG9uZyBrb25nIHByb3Rlc3RzIDIwMTkgSG9uZyBLb25n,/@CBSNews,CBS News,Hong Kong residents protest increasing Chinese control,2.9K,6 years,"Millions of protestors took to the streets of Hong Kong over fears of increasing chinese control, despite the suspension of an ...",2026-01-22 02:55:30.190633
/watch?v=rWTZ77C3xb4&pp=ygUhaG9uZyBrb25nIHByb3Rlc3RzIDIwMTkgSG9uZyBLb25n,/@VOANews,Voice of America,Time-lapse: Hong Kong Protesters March to Government Offices Demanding City Leader’s Resignation,20K,6 years,"Protesters clad in black marched in Hong Kong on Sunday, June 16, demanding that the city's leader steps down over her ...",2026-01-22 02:55:30.192116
/watch?v=VcGKxD-uIwk&pp=ygUhaG9uZyBrb25nIHByb3Rlc3RzIDIwMTkgSG9uZyBLb25n,/@trtworld,TRT World,Hong Kong Protests: Thousands stage rally on China's National Day,3K,6 years,Protestors have been staging a sit-in outside the school of a teenage activist who was injured by a live round when he was shot in ...,2026-01-22 02:55:30.193474
/watch?v=U0LvWnobB0w&pp=ygUhaG9uZyBrb25nIHByb3Rlc3RzIDIwMTkgSG9uZyBLb25n,/@euronews,euronews,Rival groups clash in Hong Kong protests,14K,6 years,Pro-democracy and pro-Beijing groups clashed in a shopping mall in Hong Kong on Saturday as unrest over alleged Chinese ...,2026-01-22 02:55:30.195627
/watch?v=cHOCghooY0Y&pp=ygUhaG9uZyBrb25nIHByb3Rlc3RzIDIwMTkgSG9uZyBLb25n,/@globalnews,Global News,Hong Kong protests: Riot police confront demonstrators in Sham Shui Po,149K,Streamed 6 years,Hong Kong riot police confronted and fired tear gas to disperse hundreds of protesters who had gathered outside a police station ...,2026-01-22 02:55:30.197035
/watch?v=BERRu2yyUDM&pp=ygUhaG9uZyBrb25nIHByb3Rlc3RzIDIwMTkgSG9uZyBLb25n,/@France24_en,FRANCE 24 English,Hong Kong protesters escalate fight in suburbs,6K,6 years,Subscribe to France 24 now: http://f24.my/youtubeEN FRANCE 24 live news stream: all the latest news 24/7 http://f24.my/YTliveEN ...,2026-01-22 02:55:30.199593
/watch?v=E03t7HFQSJk&pp=ygUhaG9uZyBrb25nIHByb3Rlc3RzIDIwMTkgSG9uZyBLb25n,/@FoxNews,Fox News,Should the US get more involved with Hong Kong protests?,64K,6 years,Trump facing pressure to speak out against crackdown; former National Security Council official Brigadier Gen. Robert Spalding ...,2026-01-22 02:55:30.202218
/watch?v=mb5wDf-fw2w&pp=ygUhaG9uZyBrb25nIHByb3Rlc3RzIDIwMTkgSG9uZyBLb25n0gcJCYcKAYcqIYzv,/@InsideEdition,Inside Edition,Hong Kong Protesters Use 'Les Mis' Song as Anthem,444K,6 years,"Throughout June, millions of protesters have been marching in Hong Kong in effort to withdraw an extradition bill that would send ...",2026-01-22 02:55:30.203678
/watch?v=qLxw19eJGv0&pp=ygUhaG9uZyBrb25nIHByb3Rlc3RzIDIwMTkgSG9uZyBLb25n,/@CBSNews,CBS News,Hong Kong protesters refuse to back down over extradition bill,14K,6 years,Protesters in Hong Kong are refusing to back down after the city's embattled leader Carrie Lam ignored a deadline to permanently ...,2026-01-22 02:55:30.206192
/watch?v=43YeR3kcESY&pp=ygUhaG9uZyBrb25nIHByb3Rlc3RzIDIwMTkgSG9uZyBLb25n,/@SouthChinaMorningPost,South China Morning Post,Rallies around the world in solidarity with Hong Kong extradition law protest,60K,6 years,Subscribe to our YouTube channel for free here: https://sc.mp/subscribe-youtube Demonstrators around the globe rallied in ...,2026-01-22 02:55:30.207509
/watch?v=mkjAhlvld68&pp=ygUhaG9uZyBrb25nIHByb3Rlc3RzIDIwMTkgSG9uZyBLb25n,/@CBSMornings,CBS Mornings,"Hong Kong protesters barricaded: ""This university is not the last battle""",80K,6 years,Around 100 pro-democracy protesters are barricaded inside a Hong Kong university in a tense standoff with police. They're facing ...,2026-01-22 02:55:30.209246
/watch?v=jzkjKQx3HOw&pp=ygUhaG9uZyBrb25nIHByb3Rlc3RzIDIwMTkgSG9uZyBLb25n,/@SouthChinaMorningPost,South China Morning Post,Hong Kong’s 2014 Occupy Central vs 2019 protests,100K,6 years,"Subscribe to our YouTube channel for free here: https://sc.mp/subscribe-youtube Five years after the Occupy Central movement, ...",2026-01-22 02:55:30.212340
/watch?v=j5YKKPizQi8&pp=ygUhaG9uZyBrb25nIHByb3Rlc3RzIDIwMTkgSG9uZyBLb25n,/@VICE,VICE,Inside Hong Kong's Fight for Freedom | Faceless (Full Film) | The Short List,556K,3 years,Faceless is an intimate portrayal of four young protestors in Hong Kong struggling to protect their freedom and way of life under ...,2026-01-22 02:55:37.980271
/watch?v=T1YlHC5ogGQ&pp=ygUhaG9uZyBrb25nIHByb3Rlc3RzIDIwMTkgSG9uZyBLb25n,/@BBCNews,BBC News,"Hong Kong protests: 'I was born here, I'm a Hongkonger too' - BBC News",90K,6 years,"Hong Kong is a Chinese city that has long had a vibrant ethnic minority community, many of whom are South Asian. They've come ...",2026-01-22 02:55:37.982552
/watch?v=oc_jMw8PZOg&pp=ygUhaG9uZyBrb25nIHByb3Rlc3RzIDIwMTkgSG9uZyBLb25n,/@CNN,CNN,Hong Kong protests over extradition bill continue,67K,6 years,Thousands of protesters in Hong Kong gathered outside the city's police headquarters demanding the government scrap a bill that ...,2026-01-22 02:55:37.984388
/watch?v=Wkhxw-FkMWU&pp=ygUhaG9uZyBrb25nIHByb3Rlc3RzIDIwMTkgSG9uZyBLb25n,/@France24_en,FRANCE 24 English,7 Hong Kong democracy leaders convicted over 2019 protests,707,4 years,Seven #HongKong pro-#democracy advocates were convicted Thursday on charges of organizing and participating in an ...,2026-01-22 02:55:37.985610
/watch?v=TFj1LfWpLLc&pp=ygUhaG9uZyBrb25nIHByb3Rlc3RzIDIwMTkgSG9uZyBLb25n0gcJCYcKAYcqIYzv,/@guardiannews,Guardian News,Hong Kong protesters storm government headquarters,75K,6 years,"Hundreds of protesters have stormed the Hong Kong government building on the anniversary of the city's 1997 return to China, ...",2026-01-22 02:55:37.987395
/watch?v=-_eg8nMzAqg&pp=ygUhaG9uZyBrb25nIHByb3Rlc3RzIDIwMTkgSG9uZyBLb25n0gcJCYcKAYcqIYzv,/@CBCTheNational,CBC News: The National,Hong Kong protests over extradition bill turn violent,7.5K,6 years,Hundreds of thousands took to the streets in Hong Kong to protest a proposed extradition law that would allow Hong Kong ...,2026-01-22 02:55:37.988668
/watch?v=suJCF1WwXng&pp=ygUhaG9uZyBrb25nIHByb3Rlc3RzIDIwMTkgSG9uZyBLb25n,/@France24_en,FRANCE 24 English,Hong Kong protesters breach the inside of parliament building,2.6K,6 years,Subscribe to France 24 now: http://f24.my/youtubeEN FRANCE 24 live news stream: all the latest news 24/7 http://f24.my/YTliveEN ...,2026-01-22 02:55:37.989810
/watch?v=4F4WfUQf8hE&pp=ygUhaG9uZyBrb25nIHByb3Rlc3RzIDIwMTkgSG9uZyBLb25n,/@aljazeeraenglish,Al Jazeera English,Hong Kong protests: Tear gas fired at demonstrators,29K,6 years,"A Hong Kong SWAT team has fired tear gas at protesters, forcing them to flee after starting a fire outside a police station.",2026-01-22 02:55:37.991165
/watch?v=-GFIfih2mNQ&pp=ygUhaG9uZyBrb25nIHByb3Rlc3RzIDIwMTkgSG9uZyBLb25n,/@ntdtv,NTD,US reaction to Hong Kong protests over proposed Extradition Bill,921,6 years,For more news and videos visit ☛ http://ntd.com Follow us on Twitter ☛ https://twitter.com/news_ntd Add us on Facebook ...,2026-01-22 02:55:37.992262
/watch?v=LJCitIFAmQk&pp=ygUhaG9uZyBrb25nIHByb3Rlc3RzIDIwMTkgSG9uZyBLb25n,/@ITVNews,ITV News,Hong Kong airport grounds all flights as protests continue | ITV News,3.5K,6 years,One of the world's busiest airports cancelled all flights after thousands of Hong Kong pro-democracy protesters crowded into the ...,2026-01-22 02:55:37.993495
/watch?v=xDX4exESh3E&pp=ygUhaG9uZyBrb25nIHByb3Rlc3RzIDIwMTkgSG9uZyBLb25n,/@SouthChinaMorningPost,South China Morning Post,Scenes of defiance as protests escalate against Hong Kong's extradition bill,19K,6 years,Subscribe to our YouTube channel for free here: https://sc.mp/subscribe-youtube Continued protests against Hong Kong's ...,2026-01-22 02:55:37.995389
/watch?v=K2OWjTeJVq8&pp=ygUhaG9uZyBrb25nIHByb3Rlc3RzIDIwMTkgSG9uZyBLb25n,/@channelnewsasia,CNA,Hong Kong protests: A timeline,12K,6 years,"After almost three months of protests, Hong Kong's embattled Chief Executive Carrie Lam went through protesters' five demands ...",2026-01-22 02:55:37.996645
/watch?v=OlV_NzITCoM&pp=ygUhaG9uZyBrb25nIHByb3Rlc3RzIDIwMTkgSG9uZyBLb25n0gcJCYcKAYcqIYzv,/@CBSNews,CBS News,China's state media spreads false information about Hong Kong protests,29K,6 years,"In Hong Kong, protests against a controversial extradition bill continue, but China is looking to downplay the unrest. According to ...",2026-01-22 02:55:37.997846
/watch?v=2j0UyrHr9DI&pp=ygUhaG9uZyBrb25nIHByb3Rlc3RzIDIwMTkgSG9uZyBLb25n,/@CNBCtelevision,CNBC Television,"Dodwell: Congressional support of Hong Kong protesters ""can't really be seen as helpful""",4.8K,6 years,"David Dodwell, executive director at HK-APEC Trade Policy Group, discusses US-China relations after House lawmakers passed ...",2026-01-22 02:55:37.999457
/watch?v=T-lCUoID3LA&pp=ygUhaG9uZyBrb25nIHByb3Rlc3RzIDIwMTkgSG9uZyBLb25n,/@telegraph,The Telegraph,Hong Kong policeman draws pistol on protesters after being beaten with own baton,510K,6 years,Footage appears to show a police officer being cornered by protesters. The officer then draws a weapon causing the crowd to ...,2026-01-22 02:55:38.001006
/watch?v=KXPp9Jslkl8&pp=ygUhaG9uZyBrb25nIHByb3Rlc3RzIDIwMTkgSG9uZyBLb25n,/@YahooFinance,Yahoo Finance,How the Hong Kong protests could impact the market,4.7K,6 years,"The protests in Hong Kong over controversial extradition legislation have turned violent. Noted macro investor Kyle Bass, CIO at ...",2026-01-22 02:55:38.002965
/watch?v=xzs1EsNdxfM&pp=ygUhaG9uZyBrb25nIHByb3Rlc3RzIDIwMTkgSG9uZyBLb25n,/@FinancialTimes,Financial Times,On the ground at the Hong Kong protests,140K,6 years,"After a day of protests about a proposed extradition law, police in Hong Kong fired pepper spray, tear gas and rubber bullets at ...",2026-01-22 02:55:38.004386
/watch?v=Zb7YsTkevcs&pp=ygUhaG9uZyBrb25nIHByb3Rlc3RzIDIwMTkgSG9uZyBLb25n,/@TheHinduOfficial,The Hindu,Hong Kong protests explained,15K,6 years,The protests that have been on in Hong Kong in full swing since in mid-June were sparked by widespread opposition to a ...,2026-01-22 02:55:38.006140
/watch?v=r2-r8KdzYm4&pp=ygUhaG9uZyBrb25nIHByb3Rlc3RzIDIwMTkgSG9uZyBLb25n,/@TheChinaProject,The China Project,"On the ground at Hong Kong extradition protests on June 9, 2019",5.7K,6 years,"Hundreds of thousands in Hong Kong (1.03 million, say organizers) took to the streets on June 9 to protest a controversial ...",2026-01-22 02:55:38.007478
/watch?v=59tD3wuaims&pp=ygUhaG9uZyBrb25nIHByb3Rlc3RzIDIwMTkgSG9uZyBLb25n,/@bbcstories,BBC Stories,Hong Kong protests: Why we stormed the parliament - BBC Stories,7.1K,6 years,"On 1 July 2019, hundreds of protesters stormed Hong Kong's Legislative Council, (Legco), spraying graffiti and defacing symbols ...",2026-01-22 02:55:38.009633
/watch?v=cNRuVXhcItI&pp=ygUhaG9uZyBrb25nIHByb3Rlc3RzIDIwMTkgSG9uZyBLb25n,/@business,Bloomberg Originals,How China Is Remaking Hong Kong in Its Own Image,470K,1 year,"It's been five years since pro-democracy protests rocked Hong Kong. Since then, China has tightened its grip on the territory, ...",2026-01-22 02:55:47.580399
/watch?v=c7TGB18bkgo&pp=ygUhaG9uZyBrb25nIHByb3Rlc3RzIDIwMTkgSG9uZyBLb25n0gcJCYcKAYcqIYzv,/@CBCNews,CBC News,Hong Kong protesters opposing extradition bill clashes with police,64K,6 years,Hundreds of thousands of protesters marched through Hong Kong to voice their opposition to a bill that would allow people to be ...,2026-01-22 02:55:47.581828
/watch?v=7DmfjkUkVTA&pp=ygUhaG9uZyBrb25nIHByb3Rlc3RzIDIwMTkgSG9uZyBLb25n,/@guardiannews,Guardian News,Carrie Lam denounces 'violent' Hong Kong protests: 'It’s time to bring back order',43K,6 years,Hong Kong chief executive Carrie Lam has called for stability after another weekend of chaotic protests that rocked the special ...,2026-01-22 02:55:47.583887
/watch?v=QjdaEuSwThQ&pp=ygUhaG9uZyBrb25nIHByb3Rlc3RzIDIwMTkgSG9uZyBLb25n,/@VOANews,Voice of America,Hong Kong Protests During China's National Celebrations,11K,6 years,Pro- democracy protesters in Hong Kong tried to disrupt China's message of unity and stability during celebrations to ...,2026-01-22 02:55:47.585227
/watch?v=94eOV3v8Azk&pp=ygUhaG9uZyBrb25nIHByb3Rlc3RzIDIwMTkgSG9uZyBLb25n,/@channelnewsasia,CNA,Protesters stage sit-in at Hong Kong airport,43K,6 years,"In Hong Kong, more than a thousand protesters staged a sit-in at the airport on Jul 26, as the city braced for another weekend of ...",2026-01-22 02:55:47.586561
/watch?v=g4Z9viG7pLM&pp=ygUhaG9uZyBrb25nIHByb3Rlc3RzIDIwMTkgSG9uZyBLb25n0gcJCYcKAYcqIYzv,/@VOANews,Voice of America,"Latest Hong Kong Protests End with Tear Gas, Rock Throwing",34K,6 years,"Hong Kong protests devolved into violence for a second consecutive night Sunday, with police firing tear gas to disperse ...",2026-01-22 02:55:47.589207
/watch?v=k3GnTE7x5S4&pp=ygUhaG9uZyBrb25nIHByb3Rlc3RzIDIwMTkgSG9uZyBLb25n,/@euronews,euronews,Hong Kong protests mark fifth anniversary of the Umbrella Movement,4.7K,6 years,And a series of protests for and against Communist Party rulers in Beijing is also planned for the Chinese-ruled city ahead of the ...,2026-01-22 02:55:47.593264
/watch?v=igr3DKX_sWM&pp=ygUhaG9uZyBrb25nIHByb3Rlc3RzIDIwMTkgSG9uZyBLb25n,/@France24_en,FRANCE 24 English,"Hong Kong protests: ""These protesters see China as a bulldozer""",5.6K,6 years,Subscribe to France 24 now: http://f24.my/youtubeEN FRANCE 24 live news stream: all the latest news 24/7 http://f24.my/YTliveEN ...,2026-01-22 02:55:47.596188
/watch?v=amQ1uRta3lw&pp=ygUhaG9uZyBrb25nIHByb3Rlc3RzIDIwMTkgSG9uZyBLb25n,/@TheYoungTurks,The Young Turks,Hong Kong Protestors Stand Up in 2019,9.6K,6 years,"Cenk Uygur, Ana Kasparian, and John Iadarola discuss the protestors in Hong Kong on TYT's 2019 Turks and Jerks special.",2026-01-22 02:55:47.598413
/watch?v=q4wbx9hIN4E&pp=ygUhaG9uZyBrb25nIHByb3Rlc3RzIDIwMTkgSG9uZyBLb25n,/@laowhy86,laowhy86,The Hong Kong Protests are DESTROYING My Family,368K,6 years,Protect Yourself Today! Go to http://NordVPN.com/Laowhy86 for 75% off of a 3 Year Plan! Use code LAOWHY86 for 1 month free!,2026-01-22 02:55:47.600091
/watch?v=vIUZUvNgQl0&pp=ygUhaG9uZyBrb25nIHByb3Rlc3RzIDIwMTkgSG9uZyBLb25n,/@VOANews,Voice of America,Hong Kong Riot Police in Plain Clothes Clash with Protesters,832K,6 years,"Riot police in plain clothes clashed with protesters in a shopping mall, Hong Kong, Sunday, November 10. Protesters threw ...",2026-01-22 02:55:47.602002
/watch?v=G_XYKt4MLEk&pp=ygUhaG9uZyBrb25nIHByb3Rlc3RzIDIwMTkgSG9uZyBLb25n,/@cgtnamerica,CGTN America,Qinduo Xu on Hong Kong protests,2.7K,6 years,Hong Kong is starting to return to normal two days after a massive protest against a controversial extradition bill. Qinduo Xu is a ...,2026-01-22 02:55:47.603327
/watch?v=gwxiezDR1dg&pp=ygUhaG9uZyBrb25nIHByb3Rlc3RzIDIwMTkgSG9uZyBLb25n,/@dwnews,DW News,Hong Kong pro-democracy and pro-Beijing protesters clash at mall | DW News,86K,6 years,A pro-democracy protest in Hong Kong was disrupted by pro-Beijing counter-demonstrators waving Chinese flags. The sit-in at a ...,2026-01-22 02:55:47.605157
