video_url,user_url,username,title,view_num,created_at,shortdesc,collected_at
/shorts/5gLrQ5lWBm0,/@Rappler,Rappler,Hong Kong protesters defy police again and begin banned march,1.5K,6 years,Subscribe: https://www.youtube.com/@Rappler/ More videos on Rappler: https://www.rappler.com/video Follow Rappler for the ...,2026-01-22 02:55:47.608339
/watch?v=K1FAo8gcO_8&pp=ygUhaG9uZyBrb25nIHByb3Rlc3RzIDIwMTkgSG9uZyBLb25n0gcJCYcKAYcqIYzv,/@ExploreMode,Explore Mode,"Hong Kong Protests: What do they want? | Hong Kong Protests, explained | EXPLORE MODE",6.9K,6 years,"CLARIFICATION*** 05:28 - Hong Kong Island, Kowloon, and The New Territories are separate regions. Hong Kong Island and ...",2026-01-22 02:55:47.612137
/watch?v=wn0flGvlFDo&pp=ygUhaG9uZyBrb25nIHByb3Rlc3RzIDIwMTkgSG9uZyBLb25n,/@SouthChinaMorningPost,South China Morning Post,How foreign politicians reacted to Hong Kong's violent protests,25K,6 years,Subscribe to our YouTube channel for free here: https://sc.mp/subscribe-youtube Foreign politicians have reacted to violent ...,2026-01-22 02:55:47.616887
/watch?v=FVDoNje7Ay0&pp=ygUhaG9uZyBrb25nIHByb3Rlc3RzIDIwMTkgSG9uZyBLb25n,/@CNBCtelevision,CNBC Television,Ferguson: Taiwan watching Hong Kong protests closely as elections approach,14K,6 years,"Niall Ferguson, senior fellow at the Hoover Institution at Stanford University, joins CNBC's ""Closing Bell"" to talk about the Hong ...",2026-01-22 02:55:47.618450
/watch?v=ZQhr6fkLMJE&pp=ygUhaG9uZyBrb25nIHByb3Rlc3RzIDIwMTkgSG9uZyBLb25n,/@France24_en,FRANCE 24 English,"Hong Kong: ""Protests will continue""",12K,6 years,Subscribe to France 24 now: http://f24.my/youtubeEN FRANCE 24 live news stream: all the latest news 24/7 http://f24.my/YTliveEN ...,2026-01-22 02:55:47.620314
/watch?v=vxSV1Mv1OKs&pp=ygUhaG9uZyBrb25nIHByb3Rlc3RzIDIwMTkgSG9uZyBLb25n,/@straitstimesonline,The Straits Times,THE BIG STORY: Hong Kong protests affecting tourism and economy (05/08/19),76K,6 years,The Straits Times' foreign editor Jeremy Au Yong discusses how Hong Kong's nine-week protests have affected the city's tourism ...,2026-01-22 02:55:47.621689
